{
  "packet_type": "team-output",
  "recorded_at": "2026-06-15T05:39:18.015Z",
  "team_output_id": "TOUT-MQES9OCF-4V93TD",
  "team_id": "runtime-team",
  "stage": "execution",
  "expected_roles": [
    "Builder",
    "Guardian"
  ],
  "received_roles": [
    "Builder",
    "Guardian"
  ],
  "missing_roles": [],
  "aggregate_state": "ready-for-council-review",
  "blocking_signals": [],
  "recommended_next_step": "Submit the execution packet to council review.",
  "joined_role_result_refs": [
    ".aof/artifacts/execution/role-results/RRES-MQES9OCD-W57VE1.json",
    ".aof/artifacts/execution/role-results/RRES-MQES9OCE-5HXTD0.json"
  ],
  "artifact_refs": [
    ".aof/artifacts/execution/role-joins/RJOIN-MQES9OCE-Q1HT75.json"
  ],
  "decision_required": true,
  "summary": "The runtime team packet is complete and ready for council review.",
  "source_task_id": "TASK-011",
  "source_parent_session_id": "SESS-MQES9OAT-79Q9C0",
  "source_decision_record_id": "DEC-MQES9OBC-BJU6QX"
}
