{
  "packet_type": "team-output",
  "recorded_at": "2026-06-15T14:02:34.091Z",
  "team_output_id": "TOUT-MQFA8VSB-FRABN7",
  "team_id": "runtime-team",
  "stage": "execution",
  "expected_roles": [
    "Builder",
    "Guardian"
  ],
  "received_roles": [
    "Builder",
    "Guardian"
  ],
  "missing_roles": [],
  "aggregate_state": "ready-for-council-review",
  "blocking_signals": [],
  "recommended_next_step": "Submit the execution packet to council review.",
  "joined_role_result_refs": [
    ".aof/artifacts/execution/role-results/RRES-MQFA8VS9-5679M8.json",
    ".aof/artifacts/execution/role-results/RRES-MQFA8VSA-ZZQNWM.json"
  ],
  "artifact_refs": [
    ".aof/artifacts/execution/role-joins/RJOIN-MQFA8VSA-IRZT1E.json"
  ],
  "decision_required": true,
  "summary": "The runtime team packet is complete and ready for council review.",
  "source_task_id": "TASK-011",
  "source_parent_session_id": "SESS-MQFA8VRN-YY30YP",
  "source_decision_record_id": "DEC-MQFA8VRY-QUISUP"
}
