{
  "packet_type": "team-output",
  "recorded_at": "2026-06-15T12:58:10.192Z",
  "team_output_id": "TOUT-MQF7Y2DS-CTW235",
  "team_id": "runtime-team",
  "stage": "execution",
  "expected_roles": [
    "Builder",
    "Guardian"
  ],
  "received_roles": [
    "Builder",
    "Guardian"
  ],
  "missing_roles": [],
  "aggregate_state": "ready-for-council-review",
  "blocking_signals": [],
  "recommended_next_step": "Submit the execution packet to council review.",
  "joined_role_result_refs": [
    ".aof/artifacts/execution/role-results/RRES-MQF7Y2DR-JU4P08.json",
    ".aof/artifacts/execution/role-results/RRES-MQF7Y2DR-45HBNI.json"
  ],
  "artifact_refs": [
    ".aof/artifacts/execution/role-joins/RJOIN-MQF7Y2DS-P50TUX.json"
  ],
  "decision_required": true,
  "summary": "The runtime team packet is complete and ready for council review.",
  "source_task_id": "TASK-011",
  "source_parent_session_id": "SESS-MQF7Y2D5-ZERRVN",
  "source_decision_record_id": "DEC-MQF7Y2DC-DYP62K"
}
