{
  "packet_type": "team-output",
  "recorded_at": "2026-06-15T05:39:18.014Z",
  "team_output_id": "TOUT-MQES9OCE-9E8HSB",
  "team_id": "runtime-team",
  "stage": "execution",
  "expected_roles": [
    "Builder",
    "Guardian"
  ],
  "received_roles": [
    "Builder",
    "Guardian"
  ],
  "missing_roles": [],
  "aggregate_state": "ready-for-council-review",
  "blocking_signals": [],
  "recommended_next_step": "Submit the execution packet to council review.",
  "joined_role_result_refs": [
    ".aof/artifacts/execution/role-results/RRES-MQES9OCD-ZKL3LM.json",
    ".aof/artifacts/execution/role-results/RRES-MQES9OCE-FCVGU7.json"
  ],
  "artifact_refs": [
    ".aof/artifacts/execution/role-joins/RJOIN-MQES9OCE-5971U8.json"
  ],
  "decision_required": true,
  "summary": "The runtime team packet is complete and ready for council review.",
  "source_task_id": "TASK-011",
  "source_parent_session_id": "SESS-MQES9OAT-65F1R1",
  "source_decision_record_id": "DEC-MQES9OBE-AXCD2E"
}
