{
  "packet_type": "team-output",
  "recorded_at": "2026-06-15T03:04:28.284Z",
  "team_output_id": "TOUT-MQEMQKCC-2Q2E72",
  "team_id": "runtime-team",
  "stage": "execution",
  "expected_roles": [
    "Builder",
    "Guardian"
  ],
  "received_roles": [
    "Builder",
    "Guardian"
  ],
  "missing_roles": [],
  "aggregate_state": "ready-for-council-review",
  "blocking_signals": [],
  "recommended_next_step": "Submit the execution packet to council review.",
  "joined_role_result_refs": [
    ".aof/artifacts/execution/role-results/RRES-MQEMQHW1-NDTJZ9.json",
    ".aof/artifacts/execution/role-results/RRES-MQEMQJ92-S764XW.json"
  ],
  "artifact_refs": [
    ".aof/artifacts/execution/role-joins/RJOIN-MQEMQJ94-Y21FUO.json"
  ],
  "decision_required": true,
  "summary": "The runtime team packet is complete and ready for council review.",
  "source_task_id": "TASK-011",
  "source_parent_session_id": "SESS-MQEMQAAF-5HL25N",
  "source_decision_record_id": "DEC-MQEMQCNH-5ZNA0N"
}
